date,username,to,replies,retweets,favorites,text,geo,mentions,hashtags,id,permalink
2019-12-04 11:43:56,CCHQPress,,161,262,440,"John McDonnell and Jeremy Corbyn's trillion pound spending spree would bankrupt Britain And the huge black hole in their spending plans would land a £2,400 tax bill on every taxpayer in the UK #costofCorbyn",,,#costofCorbyn,1202191804558446592,https://twitter.com/CCHQPress/status/1202191804558446592
2019-12-04 08:45:12,CCHQPress,politicshome,69,42,100,"Labour’s extreme plans would cost taxpayers billions and mean years of disruption and worse services #costofCorbyn",,,#costofCorbyn,1202146824024399872,https://twitter.com/CCHQPress/status/1202146824024399872
2019-12-04 08:33:21,CCHQPress,,41,90,156,"More warnings from independent experts on Labour's extreme plans Their ideological renationalisation plans would cause years of disruption and hammer people's pensions #costofCorbyn",,,#costofCorbyn,1202143844541882369,https://twitter.com/CCHQPress/status/1202143844541882369
2019-12-04 08:27:52,CCHQPress,,46,74,181,"Our education reforms are improving standards in our schools, so children can get the best start in life #VoteConservative",,,#VoteConservative,1202142463986679808,https://twitter.com/CCHQPress/status/1202142463986679808
2019-12-03 13:29:34,CCHQPress,,262,545,825,"""You'll be with us in Government"" Labour would bring the militant RMT union, behind a 27 day Xmas strike, into government Corbyn and his union baron chums would mean more strikes and more misery and disruption for millions across the country",,,,1201855998102773766,https://twitter.com/CCHQPress/status/1201855998102773766
2019-12-03 10:35:34,CCHQPress,,31,28,59,"Encouraging news Our education reforms are improving standards in our schools, ensuring children can get the best start in life Labour want to turn the clock back, abolish Ofsted and scrap strongly performing academy and free schools",,,,1201812213062868992,https://twitter.com/CCHQPress/status/1201812213062868992
2019-12-03 09:20:44,CCHQPress,,95,178,277,"Labour need to come clean on exactly which road upgrades they would scrap, and how many more strikes there would be under their plans to scrap trade union laws #costofCorbyn",,,#costofCorbyn,1201793379811647488,https://twitter.com/CCHQPress/status/1201793379811647488
2019-12-03 07:47:52,CCHQPress,,393,532,1247,"Yet another example of why Corbyn cannot be trusted with our nation's security He consistently backs our enemies while shunning our allies",,,,1201770009183358977,https://twitter.com/CCHQPress/status/1201770009183358977
2019-12-02 18:49:35,CCHQPress,,172,458,784,"Corbyn's plans to rip up strike laws would let his union baron chums strike at will, causing misery and disruption for millions #costofCorbyn",,,#costofCorbyn,1201574147429720067,https://twitter.com/CCHQPress/status/1201574147429720067
2019-12-02 10:28:19,CCHQPress,,57,106,204,"Labour's Shadow Transport Secretary this morning repeatedly refused to say which road upgrades Labour would scrap and backed a return to secondary picketing @grantshapps ""Corbyn’s Labour would bring Britain grinding to a halt"" #costofCorbyn",,@grantshapps,#costofCorbyn,1201447998993113088,https://twitter.com/CCHQPress/status/1201447998993113088
2019-12-02 07:45:55,CCHQPress,,98,146,223,"More fantasy economics from Labour, this time their Shadow Transport Secretary on @bbc5live , now claiming renationalisation won't cost a penny Read the full cost of Labour's extreme plans and how it will cost you and your family #CostOfCorbyn https://www.costofcorbyn.com/",,@bbc5live,#CostOfCorbyn,1201407131104268289,https://twitter.com/CCHQPress/status/1201407131104268289
2019-12-01 20:45:47,CCHQPress,,74,130,319,"Oh dear - Burgon has nothing to say when asked to defend the record of the Welsh Labour government running the NHS in Wales #ITVDebate",,,#ITVDebate,1201241000359927808,https://twitter.com/CCHQPress/status/1201241000359927808
2019-12-01 20:42:47,CCHQPress,,67,138,326,"Under the @Conservatives, the UK has led the world in tackling climate change We've cut emissions faster than any other G20 country Renewable electricity generation has hit a record high We are the first major economy to legislate for Net Zero #ITVDebate",,@Conservatives,#ITVDebate,1201240244915462146,https://twitter.com/CCHQPress/status/1201240244915462146
2019-12-01 20:39:19,CCHQPress,,88,202,449,"Richard Burgon doesn't know his own manifesto - Labour are committed to introducing a four-day week, which would cause staff shortages at hospitals and could cost the NHS over £6 billion a year #ITVDebate #CostOfCorbyn",,,#ITVDebate #CostOfCorbyn,1201239374622593030,https://twitter.com/CCHQPress/status/1201239374622593030
2019-12-01 20:23:18,CCHQPress,,61,221,459,"When Burgon says only the top 5% would pay, he's not telling the truth about Labour's plans for tax hikes for all #ITVDebate #costofCorbyn",,,#ITVDebate #costofCorbyn,1201235345284698112,https://twitter.com/CCHQPress/status/1201235345284698112
2019-12-01 20:18:05,CCHQPress,Conservatives,27,48,74,"Labour have already admitted who would pay for their reckless spending ""The British people will pay"" #ITVDebate #CostofCorbyn",,,#ITVDebate #CostofCorbyn,1201234031565836298,https://twitter.com/CCHQPress/status/1201234031565836298
2019-12-01 20:08:11,CCHQPress,,44,197,366,"Richard Burgon gets it wrong again. Corbyn DID actually say we should check with Putin if he was behind the Salisbury attack #ITVDebate",,,#ITVDebate,1201231540174372865,https://twitter.com/CCHQPress/status/1201231540174372865
2019-12-01 20:05:44,CCHQPress,,31,44,112,"Trident and our national defences would be up for negotiation in a Corbyn SNP alliance #ITVDebate",,,#ITVDebate,1201230921539686400,https://twitter.com/CCHQPress/status/1201230921539686400
2019-12-01 20:02:42,CCHQPress,,76,278,478,"Corbyn called for the NATO alliance to be closed down - he can’t be trusted with the nation’s security #ITVDebate",,,#ITVDebate,1201230158914568195,https://twitter.com/CCHQPress/status/1201230158914568195
2019-12-01 19:45:37,CCHQPress,,40,56,188,".@RishiSunak After we leave the EU, we can replace freedom of movement with an Australian-style points system, based on what people have to offer rather than where they are from #ITVDebate",,@RishiSunak,#ITVDebate,1201225861367812096,https://twitter.com/CCHQPress/status/1201225861367812096
2019-12-01 19:41:53,CCHQPress,,87,129,431,"Nicola Sturgeon laying down her terms for a second independence referendum as the price for propping up Corbyn's Labour Don't let it happen, #VoteConservative #ITVDebate",,,#VoteConservative #ITVDebate,1201224922506420224,https://twitter.com/CCHQPress/status/1201224922506420224
2019-12-01 19:34:47,CCHQPress,,41,55,220,"Nicola Sturgeon said we wouldn't be able to renegotiate the withdrawal agreement and get a new deal - but Boris did, and with a Conservative majority govt, we'll honour the referendum result and leave the EU with our deal #ITVDebate",,,#ITVDebate,1201223133778337795,https://twitter.com/CCHQPress/status/1201223133778337795
2019-12-01 19:31:32,CCHQPress,,95,140,431,"Richard Burgon comically can't even say if he'd support this new deal Labour claim they'd negotiate - all they offer is more dither, more delay and the whole of next year wasted on two more chaotic referendums #ITVDebate",,,#ITVDebate,1201222317206056961,https://twitter.com/CCHQPress/status/1201222317206056961
2019-12-01 19:16:59,CCHQPress,,79,139,318,".@RishiSunak Our view is that terrorists should serve their full sentence Not everyone agrees #ITVDebate",,@RishiSunak,#ITVDebate,1201218653909323778,https://twitter.com/CCHQPress/status/1201218653909323778
2019-12-01 19:12:12,CCHQPress,,74,45,133,".@RishiSunak We will always back the police and security services, giving them the powers they need to keep us safe #ITVDebate",,@RishiSunak,#ITVDebate,1201217450253180933,https://twitter.com/CCHQPress/status/1201217450253180933
2019-12-01 19:10:30,CCHQPress,,74,159,294,"With Labour, it's taxes for the many, not the few #ITVDebate #CostofCorbyn",,,#ITVDebate #CostofCorbyn,1201217023109402627,https://twitter.com/CCHQPress/status/1201217023109402627
2019-12-01 19:06:18,CCHQPress,,86,48,152,".@RishiSunak Let's end the deadlock and delay, #GetBrexitDone so we can move on and focus on people's priorities - improving and investing in our schools and hospitals, getting 20,000 more police on our streets #ITVDebate #VoteConservative",,@RishiSunak,#GetBrexitDone #ITVDebate #VoteConservative,1201215968069980161,https://twitter.com/CCHQPress/status/1201215968069980161
2019-12-01 10:46:37,CCHQPress,,298,764,1158,"Labour this morning: Corbyn on #Ridge Terrorists should ""not necessarily"" serve full sentences Isis fighters should return simply ""to face questioning"" Shadow Attorney General on #Marr No new prisons places https://www.telegraph.co.uk/news/2019/12/01/terrorists-should-not-forced-serve-full-sentence-prison-jeremy/",,,#Ridge #Marr,1201090218713124864,https://twitter.com/CCHQPress/status/1201090218713124864
2019-12-01 08:48:23,CCHQPress,,66,245,376,"Corbyn on #Ridge: ""I don't think free movement totally could ever come to an end"" ANOTHER Corbyn pledge BROKEN You just can't trust Corbyn to keep to his word",,,#Ridge,1201060461652987904,https://twitter.com/CCHQPress/status/1201060461652987904
